{
  "schemaVersion": "1.0.0",
  "updatedAt": "3030-07-01T12:00:00Z",
  "source": {
    "displayName": "ConSchedulePro",
    "vendorId": "CSP-12345",
    "appVersion": "2.4.1",
    "lastModifiedBy": "Jane Doe",
    "lastModifiedAt": "3030-07-01T12:00:00Z"
  },
  "event": {
    "id": "advanced-example",
    "displayName": {
      "en-US": "Advanced Example Convention"
    },
    "formattedAddress": "123 Fur Ave, Furville, USA",
    "startTime": "3030-08-01T00:00:00Z",
    "endTime": "3030-08-03T23:59:59Z",
    "timezone": "America/New_York",
    "description": {
      "en-US": "A futuristic furry convention for all species!"
    },
    "externalLinks": [
      {
        "displayName": {
          "en-US": "Website"
        },
        "url": "https://fuzzytestcon.example.org"
      }
    ],
    "imageThumbnailUrl": "https://cdn.example.org/thumbnails/advanced-example.jpg",
    "imageBannerUrl": "https://cdn.example.org/banners/advanced-example.jpg"
  },
  "membershipLevels": [
    {
      "id": "attendee",
      "displayName": {
        "en-US": "Attendee"
      },
      "description": {
        "en-US": "Standard membership level."
      }
    },
    {
      "id": "sponsor",
      "displayName": {
        "en-US": "Sponsor"
      },
      "description": {
        "en-US": "Enhanced membership perks."
      }
    },
    {
      "id": "superSponsor",
      "displayName": {
        "en-US": "Super Sponsor"
      },
      "description": {
        "en-US": "Top-tier membership with exclusive benefits."
      }
    }
  ],
  "tracks": [
    {
      "id": "artTrack",
      "displayName": {
        "en-US": "Art Track"
      },
      "description": {
        "en-US": "Panels and workshops related to drawing, painting, crafts."
      }
    },
    {
      "id": "writingTrack",
      "displayName": {
        "en-US": "Writing Track"
      },
      "description": {
        "en-US": "Events focused on creative writing and story crafting."
      }
    }
  ],
  "sessionTypes": [
    {
      "id": "panel",
      "displayName": {
        "en-US": "Panel"
      },
      "description": {
        "en-US": "A talk or discussion with one or more panelists."
      }
    },
    {
      "id": "workshop",
      "displayName": {
        "en-US": "Workshop"
      },
      "description": {
        "en-US": "Hands-on sessions for learning new skills."
      }
    },
    {
      "id": "meetup",
      "displayName": {
        "en-US": "Meetup"
      },
      "description": {
        "en-US": "Casual gathering around a common interest."
      }
    }
  ],
  "labels": [
    {
      "id": "18plus",
      "displayName": {
        "en-US": "18+"
      },
      "description": {
        "en-US": "Restricted to attendees age 18 and older."
      }
    },
    {
      "id": "aslInterpretation",
      "displayName": {
        "en-US": "ASL Interpretation"
      },
      "description": {
        "en-US": "An ASL interpreter will be present."
      }
    },
    {
      "id": "ticketed",
      "displayName": {
        "en-US": "Ticketed Event"
      },
      "description": {
        "en-US": "Requires a separate ticket purchase."
      }
    }
  ],
  "venues": [
    {
      "id": "conventionCenter",
      "displayName": {
        "en-US": "Furtown Convention Center"
      },
      "formattedAddress": "123 Fur Ave, Furville, USA"
    },
    {
      "id": "furCafe",
      "displayName": {
        "en-US": "Fur Café (Off-Site)"
      },
      "formattedAddress": "999 Coffee St, Furville, USA"
    }
  ],
  "rooms": [
    {
      "id": "mainHall",
      "displayName": {
        "en-US": "Main Hall"
      },
      "capacity": 500,
      "venueId": "conventionCenter"
    },
    {
      "id": "artRoomA",
      "displayName": {
        "en-US": "Art Room A"
      },
      "capacity": 100,
      "venueId": "conventionCenter"
    },
    {
      "id": "artRoomB",
      "displayName": {
        "en-US": "Art Room B"
      },
      "capacity": 100,
      "venueId": "conventionCenter"
    },
    {
      "id": "backPatio",
      "displayName": {
        "en-US": "Back Patio"
      },
      "venueId": "furCafe"
    }
  ],
  "hosts": [
    {
      "id": "p-001",
      "displayName": "Alofoxx",
      "externalLinks": [
        {
          "displayName": {
            "en-US": "Twitter"
          },
          "url": "https://twitter.example.org/alofoxx"
        },
        {
          "displayName": {
            "en-US": "Website"
          },
          "url": "https://alofoxx.example.org"
        }
      ],
      "imageBannerUrl": "https://cdn.example.org/photos/alofoxx-banner.jpg"
    },
    {
      "id": "p-002",
      "displayName": "Alofoxx’s Guest",
      "externalLinks": [
        {
          "displayName": {
            "en-US": "Instagram"
          },
          "url": "https://instagram.example.org/alofoxx"
        }
      ]
    }
  ],
  "sessions": [
    {
      "id": "s-100",
      "displayName": {
        "en-US": "Wolf Roundtable"
      },
      "description": {
        "en-US": "A casual meetup for wolves and wolf enthusiasts."
      },
      "timeSlots": [
        {
          "startTime": "3030-08-01T10:00:00-04:00",
          "endTime": "3030-08-01T11:00:00-04:00",
          "roomIds": ["mainHall"],
          "hostIds": ["p-002"]
        },
        {
          "startTime": "3030-08-01T14:00:00-04:00",
          "endTime": "3030-08-01T15:00:00-04:00",
          "roomIds": ["mainHall"]
        },
        {
          "startTime": "3030-08-02T10:00:00-04:00",
          "endTime": "3030-08-02T11:00:00-04:00",
          "roomIds": ["backPatio"]
        }
      ],
      "typeId": "meetup",
      "labelIds": [],
      "allowedMembershipLevelIds": ["attendee", "sponsor", "superSponsor"],
      "minAge": 0,
      "ticketed": false,
      "imageBannerUrl": "https://cdn.example.org/event-banners/wolf-roundtable.png",
      "externalLinks": [
        {
          "displayName": {
            "en-US": "RSVP"
          },
          "url": "https://rsvp.example.org/event/wolf-roundtable"
        }
      ],
      "source": {
        "vendorId": "Vendor-Sys-XYZ",
        "appVersion": "1.0.3",
        "lastModifiedBy": "VendorBot"
      },
      "x-meta": {
        "badgeLevel": "CustomDataForExternalApps"
      }
    },
    {
      "id": "s-101",
      "displayName": {
        "en-US": "Painting Techniques"
      },
      "description": {
        "en-US": "Workshop on painting anthropomorphic characters."
      },
      "timeSlots": [
        {
          "startTime": "3030-08-01T14:00:00-04:00",
          "endTime": "3030-08-01T16:00:00-04:00",
          "roomIds": ["artRoomA", "artRoomB"],
          "hostIds": ["p-001"]
        }
      ],
      "typeId": "workshop",
      "trackId": "artTrack",
      "labelIds": ["aslInterpretation"],
      "allowedMembershipLevelIds": ["attendee", "sponsor", "superSponsor"],
      "minAge": 0,
      "ticketed": false
    },
    {
      "id": "s-102",
      "displayName": {
        "en-US": "Night Howl Social (18+)"
      },
      "description": {
        "en-US": "An after-dark social event for adult attendees."
      },
      "timeSlots": [
        {
          "startTime": "3030-08-01T23:00:00-04:00",
          "endTime": "3030-08-02T01:00:00-04:00",
          "roomIds": ["backPatio"]
        }
      ],
      "typeId": "panel",
      "labelIds": ["18plus", "ticketed"],
      "allowedMembershipLevelIds": ["attendee", "sponsor", "superSponsor"],
      "minAge": 18,
      "ticketed": true,
      "externalLinks": [
        {
          "displayName": {
            "en-US": "Buy Ticket"
          },
          "url": "https://tickets.example.org/event/night-howl"
        }
      ]
    }
  ]
}
